{
  "report_id": "sm-brief-001",
  "packet_id": "sm-watch-001",
  "created_at": "2026-03-20T14:30:00Z",
  "symbols": ["AAPL", "MSFT"],
  "briefs": [
    {
      "symbol": "AAPL",
      "thesis_or_watch_reason": "Services growth and iPhone refresh cycle; AI integration narrative",
      "catalyst_summary": "Upcoming earnings (Q2); potential AI feature announcements at WWDC; Services segment growth trajectory",
      "risk_summary": "China demand uncertainty; regulatory scrutiny on App Store; iPhone upgrade cycle elongation",
      "evidence_sources": [
        { "type": "earnings", "title": "AAPL Q1 2026 Earnings", "date": "2026-01-30" },
        { "type": "news", "title": "Apple Services Revenue", "date": "2026-02-15" }
      ],
      "open_questions": ["Timing of AI features; China sales trajectory"],
      "confidence_band": "medium",
      "review_recommendation": "monitor"
    },
    {
      "symbol": "MSFT",
      "thesis_or_watch_reason": "Azure AI growth; OpenAI partnership; cloud margin trajectory",
      "catalyst_summary": "Azure AI revenue acceleration; Copilot adoption metrics; capital expenditure guidance",
      "risk_summary": "Regulatory scrutiny on OpenAI relationship; cloud competition; capex intensity",
      "evidence_sources": [
        { "type": "earnings", "title": "MSFT Q2 2026 Earnings", "date": "2026-01-28" },
        { "type": "news", "title": "Azure AI Demand", "date": "2026-03-01" }
      ],
      "open_questions": ["Capex guidance for FY26; Copilot attach rates"],
      "confidence_band": "medium",
      "review_recommendation": "dig deeper"
    }
  ]
}
